2024-06-08 14:29:58.342780 IP 192.168.1.46.34926 > 255.255.255.255.10102: UDP, length 288
2024-06-08 14:29:59.096475 IP 192.168.1.46.10102 > 255.255.255.255.10102: UDP, length 1104
2024-06-08 14:30:00.380240 IP 192.168.1.46.34926 > 255.255.255.255.10102: UDP, length 288
2024-06-08 14:30:01.606244 IP 192.168.1.46.10102 > 255.255.255.255.10102: UDP, length 1104
2024-06-08 14:30:01.841872 IP6 fe80::3a2c:4aff:feb9:1130.5353 > ff02::fb.5353: 0 [7q] PTR (QM)? _ftp._tcp.local. PTR (QM)? _nfs._tcp.local. PTR (QM)? _afpovertcp._tcp.local. PTR (QM)? _smb._tcp.local. PTR (QM)? _sftp-ssh._tcp.local. PTR (QM)? _webdavs._tcp.local. PTR (QM)? _webdav._tcp.local. (118)
2024-06-08 14:30:01.841872 IP 192.168.1.12.5353 > 224.0.0.251.5353: 0 [7q] PTR (QM)? _ftp._tcp.local. PTR (QM)? _nfs._tcp.local. PTR (QM)? _afpovertcp._tcp.local. PTR (QM)? _smb._tcp.local. PTR (QM)? _sftp-ssh._tcp.local. PTR (QM)? _webdavs._tcp.local. PTR (QM)? _webdav._tcp.local. (118)
2024-06-08 14:30:02.419730 IP 192.168.1.46.34926 > 255.255.255.255.10102: UDP, length 288
2024-06-08 14:30:04.116880 IP 192.168.1.46.10102 > 255.255.255.255.10102: UDP, length 1104
2024-06-08 14:30:04.459274 IP 192.168.1.46.34926 > 255.255.255.255.10102: UDP, length 288
2024-06-08 14:30:06.498836 IP 192.168.1.46.34926 > 255.255.255.255.10102: UDP, length 288
2024-06-08 14:30:06.634835 IP 192.168.1.46.10102 > 255.255.255.255.10102: UDP, length 1104
2024-06-08 14:30:06.951987 IP 192.168.1.50.42168 > 176.58.116.254.5000: Flags [S], seq 3594107030, win 64240, options [mss 1460,sackOK,TS val 2123707036 ecr 0,nop,wscale 7], length 0
2024-06-08 14:30:06.963249 IP 176.58.116.254.5000 > 192.168.1.50.42168: Flags [S.], seq 3848673948, ack 3594107031, win 65160, options [mss 1452,sackOK,TS val 742531868 ecr 2123707036,nop,wscale 7], length 0
2024-06-08 14:30:06.963275 IP 192.168.1.50.42168 > 176.58.116.254.5000: Flags [.], ack 1, win 502, options [nop,nop,TS val 2123707048 ecr 742531868], length 0
2024-06-08 14:30:08.538479 IP 192.168.1.46.34926 > 255.255.255.255.10102: UDP, length 288
2024-06-08 14:30:09.142393 IP 192.168.1.46.10102 > 255.255.255.255.10102: UDP, length 1104
2024-06-08 14:30:10.579444 IP 192.168.1.46.34926 > 255.255.255.255.10102: UDP, length 288
2024-06-08 14:30:11.415328 IP 192.168.1.12.57621 > 192.168.1.255.57621: UDP, length 44
2024-06-08 14:30:11.654310 IP 192.168.1.46.10102 > 255.255.255.255.10102: UDP, length 1104
2024-06-08 14:30:11.963528 IP 192.168.1.50.42168 > 176.58.116.254.5000: Flags [F.], seq 1, ack 1, win 502, options [nop,nop,TS val 2123712048 ecr 742531868], length 0
2024-06-08 14:30:11.972161 ARP, Request who-has 192.168.1.50 tell 192.168.1.1, length 46
2024-06-08 14:30:11.972168 ARP, Reply 192.168.1.50 is-at 08:00:27:4d:96:28, length 28
2024-06-08 14:30:11.974665 IP 176.58.116.254.5000 > 192.168.1.50.42168: Flags [F.], seq 1, ack 2, win 510, options [nop,nop,TS val 742536880 ecr 2123712048], length 0
2024-06-08 14:30:11.974683 IP 192.168.1.50.42168 > 176.58.116.254.5000: Flags [.], ack 2, win 502, options [nop,nop,TS val 2123712059 ecr 742536880], length 0
2024-06-08 14:30:12.618706 IP 192.168.1.46.34926 > 255.255.255.255.10102: UDP, length 288
2024-06-08 14:30:14.161927 IP 192.168.1.46.10102 > 255.255.255.255.10102: UDP, length 1104
2024-06-08 14:30:14.224710 IP 192.168.1.12.33951 > 239.255.255.250.1900: UDP, length 173
2024-06-08 14:30:14.372229 IP 192.168.1.46.5353 > 224.0.0.251.5353: 0 PTR (QM)? _googlecast._tcp.local. (40)
2024-06-08 14:30:14.372562 IP6 fe80::46d8:78ff:febe:442.5353 > ff02::fb.5353: 0 PTR (QM)? _googlecast._tcp.local. (40)
2024-06-08 14:30:14.373587 IP 192.168.1.46.5353 > 224.0.0.251.5353: 0*- [0q] 1/0/3 PTR TPM191E-ddcd33d2f0f6938e0dd62e5e8980e68a._googlecast._tcp.local. (342)
2024-06-08 14:30:14.375581 IP6 fe80::46d8:78ff:febe:442.5353 > ff02::fb.5353: 0*- [0q] 1/0/3 PTR TPM191E-ddcd33d2f0f6938e0dd62e5e8980e68a._googlecast._tcp.local. (354)
2024-06-08 14:30:14.657123 IP 192.168.1.46.34926 > 255.255.255.255.10102: UDP, length 288
2024-06-08 14:30:15.225179 IP 192.168.1.12.33951 > 239.255.255.250.1900: UDP, length 173
2024-06-08 14:30:16.225626 IP 192.168.1.12.33951 > 239.255.255.250.1900: UDP, length 173

